<?xml version="1.0" encoding="UTF-8"?>

<config xmlns:ns="LocalRec"
		 xmlns:xsi="http://www.w3.org/2001/XMLSchema-instance" 
        xsi:schemaLocation="/Users/robert/Documents/ScalaWorkspace/LocalRec/LocalRec.xsd">
	<globalSettings>
		<numThreads>4</numThreads>
	</globalSettings>
	<multiCV>
		<outputFile>-</outputFile>
		<fileDatalist>
			<inputFile>/Users/robert/Documents/ScalaWorkspace/LocalRec/ml-100k/u.data</inputFile>
			<separator>\t</separator>
		</fileDatalist>
		<randomSeed>1</randomSeed>
		<folds>5</folds>
		<guessZero/>
		<plsa>
			<steps>2</steps>
			<classes>3</classes>
			<holdOutCases>1000</holdOutCases>
		</plsa>
	</multiCV>
	
<!--
	<crossVal>
		<outputFile>outfile.txt</outputFile>
		<normaliseDataList>
			<normalisationFactor>5</normalisationFactor>
			<fileDatalist>
				<inputFile>/Users/robert/Documents/ScalaWorkspace/LocalRec/ml-100k/u.data</inputFile>
				<separator>\t</separator>
			</fileDatalist>
		</normaliseDataList>
		<plsa>
			<steps>5</steps>
			<classes>5</classes>
			<holdOutCases>10000</holdOutCases>
		</plsa>
		<randomSeed>1</randomSeed>
		<folds>5</folds>
	</crossVal> 
	<examineUser>
		<outputFile>/Users/robert/user1rec.txt</outputFile>
		<normaliseDataList>
			<normalisationFactor>0.01</normalisationFactor>
			<binaryFileDatalist>
				<inputFile>/Users/robert/Documents/ScalaWorkspace/LocalRec/ml-1m/ratingsBin.dat</inputFile>
			</binaryFileDatalist>
		</normaliseDataList>
		<plsa>
			<steps>20</steps>
			<classes>5</classes>
			<holdOutCases>100001</holdOutCases>
		</plsa>
		<userNumber>1</userNumber>
		<movieFile>/Users/robert/Documents/ScalaWorkspace/LocalRec/ml-1M/movies.dat</movieFile>
		<separator>::</separator>
	</examineUser>-->
</config>